{
  "$schema": "http://json-schema.org/draft-07/schema#",
  "type": "object",
  "properties": {
    "installDataDirPath": {
      "type": "string"
    },
    "port": {
      "type": "string",
      "pattern": "^[0-9]+$"
    },
    "serverName": {
      "type": "string"
    },
    "serverManagerUrl": {
      "type": "string",
      "format": "uri"
    },
    "workspaceStorageFilePath": {
      "type": "string"
    },
    "runCommandPath": {
      "type": "string"
    }
  },
  "required": [
    "port",
    "serverName",
    "serverManagerUrl",
    "workspaceStorageFilePath",
    "runCommandPath"
  ]
}
