{
    "installDataDirPath":"~/EcosystemData",
    "port":"8093",
    "serverName":"PackageDeveloperWebappInstance",
    "serverManagerUrl": "http://localhost:8093/server-manager/status",
    "workspaceStorageFilePath":"~/virtual-desk-state/local-databases/package-developer-workspace-store-service.sqlite",
    "runCommandPath":"/home/kadisk/EcosystemData/executables/run"
}
